{
  "schema_version": "schema_v1",
  "benchmark_version": "v0.2",
  "rubric_version": "rubric_v1",
  "metrics_version": "metrics_v2",
  "created_at": "2026-04-22T10:18:40.5046537Z",
  "instance_count_by_domain": {
    "arrays": 4,
    "dp": 4,
    "graph": 4,
    "greedy": 4,
    "sorting": 4,
    "trees": 4
  },
  "instance_hashes": {
    "arrays_binary_search_001": "sha256:f2867954d1804afe76c914af385f8f42f452db2ffaeef351750d80c3c75c4399",
    "arrays_binary_search_002": "sha256:66899cec288b1e2d33df2f254a35f501ec782359f27b2e163c0ab7de522f3bcb",
    "arrays_max_subarray_001": "sha256:0d20c94a0d78e7178ad16244719a90337df5e61e9170d682116267303ed046f5",
    "arrays_max_subarray_002": "sha256:5cdffb6c82b1b4617e81054dc97074a9791b9a7db5607d4ee273f6e16a2f5744",
    "dp_knapsack_01_001": "sha256:3fa423fde54dad178648cf2f7b1db74dd0cf3a06c4832e82a1254579463ff256",
    "dp_knapsack_01_002": "sha256:d9f0eb4411cee328dd8a083f5a05748a74abb5fafb2066b2be0632ffe1e6e49d",
    "dp_longest_common_subsequence_001": "sha256:1319f5e3e9c392ac05947020338e239e34262c70e6d62130971ad74fa2de9e4d",
    "dp_longest_common_subsequence_002": "sha256:b8066c623a725d7496dd143f490f9a9638f6e34bc4f28b74688bce2c6f44509a",
    "graph_bfs_shortest_path_001": "sha256:844667478ca9b06e33a483de3b4c7cc24f6aec7f12380001c97cd4e48b30ee4c",
    "graph_bfs_shortest_path_002": "sha256:660698c154e24dd98f32af4ba159ef680201327f0c39a46bcb7d6d36943f59a2",
    "graph_dijkstra_001": "sha256:a2683d80861ab1577b13f205e749a0efe871c8dd44219df2e76b1a2218c77dfa",
    "graph_dijkstra_002": "sha256:bccfab7ac009f6e8b60f889a790918bc5b057e6b99c7f16e1a0c97e1b6b517c3",
    "greedy_coin_change_canonical_001": "sha256:c97543a184e239e66091f3ef446cd72caaa7d996e7a578fae44ea55fef29181e",
    "greedy_coin_change_canonical_002": "sha256:ab816746a80a9932bc5ada6fc606ca3a3f7b62fd6c5c8bf2caa9c3313a13c956",
    "greedy_interval_scheduling_001": "sha256:78895dd83123464eddeb45366428f787516fce0fcef2471ea40a73d9da8b9402",
    "greedy_interval_scheduling_002": "sha256:f3a74de78edde856f670d615ee0b4036039a254fca2978ddbf004c0cd71af9e1",
    "sorting_insertion_sort_001": "sha256:5fd8053ce5f496589a26e7eb69bf090dca8dc4bcbda134d1f3b077201d377a6a",
    "sorting_insertion_sort_002": "sha256:355501a018e699a39218d86cc57a0562a54931025ec253f07e2b96625644055b",
    "sorting_merge_sort_001": "sha256:acc34a40d52b1e09538ebde815c228352a27ee374df08240f57c6043bad7665b",
    "sorting_merge_sort_002": "sha256:74d07ca053723d1dc70f30d7850df4870b433943a3bc3183c9c8d46607772361",
    "trees_bst_insert_001": "sha256:3b1be2c40cb0ffa706a6d81238f3b277257dc6acdefc32e395782d81e6568ee5",
    "trees_bst_insert_002": "sha256:138bd7dc6d94297035846fe78a347710273d33ccbc14d1295ef629ca44e12b3a",
    "trees_lowest_common_ancestor_001": "sha256:914d462ef2e297c241c13fc67769bd8371e5d5f089d1c6b5e3998b1ecadb6a3c",
    "trees_lowest_common_ancestor_002": "sha256:c5141d684e6bf9b68eafbffe09e4eb39876e1e3b1e1753f22e458ff89e64141c"
  },
  "content_hash": "sha256:cb35dc0be923a2e4012f920b55ae855c22699c76175f472f18eed43fd947c883"
}