{
  "schema_version": "schema_v1",
  "benchmark_version": "v0.3",
  "rubric_version": "rubric_v1",
  "metrics_version": "metrics_v2",
  "created_at": "2026-04-26T12:55:16.0232608Z",
  "instance_count_by_domain": {
    "arrays": 14,
    "dp": 14,
    "graph": 14,
    "greedy": 14,
    "sorting": 14,
    "trees": 14
  },
  "instance_hashes": {
    "arrays_binary_search_001": "sha256:e0a7e09a0505209132fcc88d02b62fc7296c135076394fb2242f1c5e4e65e7ed",
    "arrays_binary_search_002": "sha256:11757e6b3b5b6478257ebba282342f64a55ee56f91f9d5b13c12d6d33bf86739",
    "arrays_binary_search_003": "sha256:dae56f753b0993c8f73cc1c8a45e4c79808be446f1452f041dae841d80879a3d",
    "arrays_binary_search_004": "sha256:778cb2bdea461b3c811fac0ce9fb3b0801b8a24456f1b5a01b5ec312ffca7f7d",
    "arrays_binary_search_005": "sha256:c4bb25cd7bbc46bca9493d2ad559c085cc8ddf6be1286835459ee6b82157cccd",
    "arrays_binary_search_006": "sha256:f6f61978e9f939d990ec992b001a6d8c3ce06d2103acea442b50e863a22ebba6",
    "arrays_binary_search_007": "sha256:f47c47cf8761b8b458b7504f1fe0a1df5b2dbcadb443af70f745c3219509dea4",
    "arrays_max_subarray_001": "sha256:90bb85469ff6f2f1f035c2aaaacb96f607d994a20deeedbb819fa9a3017c99b1",
    "arrays_max_subarray_002": "sha256:b5ce43f05e301b141d1e4b30147330fc82de0fdbd2e3645ff7891d711955cf08",
    "arrays_max_subarray_003": "sha256:47eea50ac45a9fb976b2590e5d2a1d568174b94e66aeecff4873b9c8a5904289",
    "arrays_max_subarray_004": "sha256:a0a90670c345248de5befdf58f94dd0cd55d6b912e921ea3e51cea7b8e491b83",
    "arrays_max_subarray_005": "sha256:dd9b40e682caa68305b79bc338b515178e05e5480594dd66935bae96a2fdb725",
    "arrays_max_subarray_006": "sha256:f1fcf1680fd8ca4dc771982d13e7d23c14b0ced2fb28f418ab6365752ba7df85",
    "arrays_max_subarray_007": "sha256:404dc289a58cd9acf6a1349bc6df606e5bd1beab68c28eb0bb3665ecc0948ad6",
    "dp_knapsack_01_001": "sha256:0b1c373bb1581088ffa997c8f224a97660e230cf1b4934cabdff1e1ae3e8144e",
    "dp_knapsack_01_002": "sha256:83f122938dc12c34bc085c8b86d6149e746b88ceeb9e5a03bba8aadc41c5e3de",
    "dp_knapsack_01_003": "sha256:1ec5fc43e3eee2a8ffdc8f4bb0e5a6f740196fc8f64745ab6463363cf552c3e2",
    "dp_knapsack_01_004": "sha256:0b03a9fd86186d94d0c107bc9b9a8bead68c9e539577bd138c1c05a78639ac02",
    "dp_knapsack_01_005": "sha256:e0db5f631107fd7de069f6cdf6041cdf811228bc049862de9b29aaad4959abce",
    "dp_knapsack_01_006": "sha256:092592bd9b35b59bd79ee8e9027e102a7e77c7d53609bc68ad0389e829122474",
    "dp_knapsack_01_007": "sha256:b17ba2bc8c63fa2b351cadd2c3bf15c544b72d823db8d565c51a644ad8e0460a",
    "dp_longest_common_subsequence_001": "sha256:a35f47a719a6e6cda1acc0a1ee4628fd60e8490d37922941ddc63be2d4bd0e93",
    "dp_longest_common_subsequence_002": "sha256:ba92ffb215f88d036c5011f5c5b0f57032b407e12e25938d4473b35e1a6a89d8",
    "dp_longest_common_subsequence_003": "sha256:50580b405901cf32e35b4aaff06461aba156c6ffd17606590be4de0572430afe",
    "dp_longest_common_subsequence_004": "sha256:99b95735d887de18ea4a18a2dacb426ee657e66daee388708c1624af718d4929",
    "dp_longest_common_subsequence_005": "sha256:dc56bfb84079c3a236bb59a967105718d80fd68fcde703e317540b950abb5b32",
    "dp_longest_common_subsequence_006": "sha256:89287bdadfddff45255fc3806e9ab2f4c541ee7edb2ffb3432bcab21867db6fd",
    "dp_longest_common_subsequence_007": "sha256:9db91dd8b719be21566d0659f175ca6fdd48ae1b681c164510660c77e7c6adaf",
    "graph_bfs_shortest_path_001": "sha256:ced8460597db693e760888c9bdaa0176563349648d087f622298ffe0578b8c38",
    "graph_bfs_shortest_path_002": "sha256:94e5f02530da1c819f8c347e27ffb0954f49caf16368a0c1498490e44c19f26e",
    "graph_bfs_shortest_path_003": "sha256:b2e7ed22b5663b9ee5c9babeb9a61a7b913f346bc51b7f3de3f72d7847f10a58",
    "graph_bfs_shortest_path_004": "sha256:7c928a264a21099f84ade025d97000459ffe3b6c14c58c5f2ef2505eddc821c4",
    "graph_bfs_shortest_path_005": "sha256:c8f35230a064d897b5dee95d27fbd4fc915241e0ee904fa5472fd551b8012efb",
    "graph_bfs_shortest_path_006": "sha256:e547d17eed501e02cecb5315d6e2dd64f90187c548af1d4916b7d90bf78e5578",
    "graph_bfs_shortest_path_007": "sha256:173f674fb5ad338ef162c223755ed8e222fb89201120d75792d84e313946fbde",
    "graph_dijkstra_001": "sha256:14690c34872a8cb3d6fa8342c46068cd31b24f965884247ccd7158dec101d4ca",
    "graph_dijkstra_002": "sha256:56c18e6e7dbce45fe8fac53067e1e0a0ea667f8509998d2b4b28ab51384ea6bc",
    "graph_dijkstra_003": "sha256:6f763eced1c3d89998fd3f65976f8b75abb114c5a9728d6d9b62a7de3762294d",
    "graph_dijkstra_004": "sha256:49fb487a29307df6c4c20487b97b205de5b12f54737181eaaf3c721f4157dc18",
    "graph_dijkstra_005": "sha256:211631294148eedce9e41f610ca951f6e48a309c816656260af4955058d8ce0b",
    "graph_dijkstra_006": "sha256:31c48bbcfa9af9654f9df2d1b5aff49019bde9bd7107ee8b94e214c7ff2cdd84",
    "graph_dijkstra_007": "sha256:5c15f917b507f5b2b4600cc5f9bddbd4fa10d12a131d49e8a4530b40c04683cf",
    "greedy_coin_change_canonical_001": "sha256:b833735a66024c934a5e53b4fbda74e69f8cb41d67b4765295cc634ce3b30e3f",
    "greedy_coin_change_canonical_002": "sha256:dd3c1ddfdd57af373c6be7f7776352d457fc0235d6c91edcc5299596c670f4bd",
    "greedy_coin_change_canonical_003": "sha256:2d6895c0a4220677857798514074fb5755152c6af2fb290df3f76694b52d91da",
    "greedy_coin_change_canonical_004": "sha256:35d8ab0dd88fe041df4f3fc009bc3d2411795e8c3a135c547977ac90630283da",
    "greedy_coin_change_canonical_005": "sha256:3bdd3eb11b920af580af2fc8b8f5acfc5a43bf7c8928e9ac010af03d9e99641c",
    "greedy_coin_change_canonical_006": "sha256:b766b0ddf847a8423b4f696379fbb6785d6c03418ef0eaeafd52bc6cec062437",
    "greedy_coin_change_canonical_007": "sha256:6078bc77edad04943ceca4faaef412e95fad7395a103ff0afb60973e670903ee",
    "greedy_interval_scheduling_001": "sha256:513d0e1821f1bf6a1e716add8aa1043288db7b5c7bdfd4508aedc669782fee14",
    "greedy_interval_scheduling_002": "sha256:2cf933280f067364aa6adb5489da33dc6566c213846d94d40b3cf97684fbcb91",
    "greedy_interval_scheduling_003": "sha256:e415921559ed637622e9af2bbe92e22d6f6acfe729e1b80ff8d03e29a5a8cc21",
    "greedy_interval_scheduling_004": "sha256:aeb059e5b3372bc68a89a8d39683e8948075eb0344d7b60e50aeb75297c1df82",
    "greedy_interval_scheduling_005": "sha256:57011790fb6d01b6b2bb510350312f4ec4edc5937433b225e87f6e8c49f74d20",
    "greedy_interval_scheduling_006": "sha256:670a98c0926691e85b4379636c089d593a2b9fe685eea9f51f0bcdccd166a7a9",
    "greedy_interval_scheduling_007": "sha256:c5a81c15ee83369dae089c7701ae1cc5b4d36e1d02ed0bb4d2b06a10f49c2442",
    "sorting_insertion_sort_001": "sha256:dc9b2c7cc004fc9c24cc7d97237a6b50504f0e5438b083a8daf24713bc560351",
    "sorting_insertion_sort_002": "sha256:1320b232063e36c99c6d3cd89e9ca638715f74eb7bed13d9e5f3ba6712b75e6e",
    "sorting_insertion_sort_003": "sha256:dfaf4e61b56d0277ec9d90c8d16d7d580ce507239c13db5710faf1ca3e43ac9f",
    "sorting_insertion_sort_004": "sha256:38b954030f0b753c264c51f9742e7d033e9bd2583d6f29961bd5382440480177",
    "sorting_insertion_sort_005": "sha256:847d150b5cfac1cbe16541e5b9138a84ce371a73243a1864352eb124aac77eec",
    "sorting_insertion_sort_006": "sha256:ed58cd2d0a41fa0d80d8448db0d89541a9c72215f167c445f39968fc15adb312",
    "sorting_insertion_sort_007": "sha256:fbf4fb11897e4749e1266e5f7a430ccf326378fa9069259f6be42a08b6cb98d9",
    "sorting_merge_sort_001": "sha256:89c44a51be85ff098de2a1da59c576a352f0952a50535d081541d29cbace2476",
    "sorting_merge_sort_002": "sha256:0b91bf8b3d660f01dc58c351eefb2ac4bec215e17535ad7a53f2a46b56069cf4",
    "sorting_merge_sort_003": "sha256:e0a8a973afe8f495b14edd2293b32f46a56c51707fa21229d2cb663b11248431",
    "sorting_merge_sort_004": "sha256:f0e93f15b1ff6c2f660dd3e9019f22f666b0f6640e2a4002a8695a7c77987292",
    "sorting_merge_sort_005": "sha256:1e168b078e55e76068ae27622eb018a3220fa9861295db83e19be2576a8c1489",
    "sorting_merge_sort_006": "sha256:a29cf3edeb6b60b16ff29ee2aca3749e0bdfc3c529c103a22595ecaf3886897c",
    "sorting_merge_sort_007": "sha256:943068daf98defc89df77b47b06898746b2a01a40bee6751db34b28daf409c17",
    "trees_bst_insert_001": "sha256:634eac1e25d266963eb908b81bba9bdb0b504047d698ca69df19a86390aa0089",
    "trees_bst_insert_002": "sha256:9b2425422949e2543931a04c9fd18c68a296061ea81ab929cb637b41fbdeceb2",
    "trees_bst_insert_003": "sha256:eeb78c905b8f1e6b7727d5d188b56dc2bb7c65e0b7ad5730ef9fdcba3566c58e",
    "trees_bst_insert_004": "sha256:01cf64096dcbf14d5e0066782e364596fe8ebfe7e5a3f096fc3f0cb854b01458",
    "trees_bst_insert_005": "sha256:2ef52c6937b85e406c42c4fc09b07ea8b59a1e8f3bd215b1172c3b331a81095f",
    "trees_bst_insert_006": "sha256:4abf04e7c233cf72335a03975334999880d6a7ed6c554cab3046b0e6bd3a5e76",
    "trees_bst_insert_007": "sha256:deab919534357ff708f18859b59b4af61505ae8ca63238ca05ad98b9cbea52c8",
    "trees_lowest_common_ancestor_001": "sha256:ffa889bc2aaf93db7b5f6f0060c5fd83df6eff1be51fc1c3e5628d591278b4c0",
    "trees_lowest_common_ancestor_002": "sha256:d6938c5a921ce5dc703517022d3f7ad8982a63fd9f868862f82786bd36813c58",
    "trees_lowest_common_ancestor_003": "sha256:201788dbe039a0c2dc9ada1e955aa0d0db84584c555720149284971b1727ac24",
    "trees_lowest_common_ancestor_004": "sha256:f1f2c8b9cc64f8a697b16295181469c005979ab7d417a4984277b71d902c28c1",
    "trees_lowest_common_ancestor_005": "sha256:fa524ca431514ffec74590f19a3154fade8a6562ece720f9e69ea0e44ebbd7fa",
    "trees_lowest_common_ancestor_006": "sha256:81f02d4a940309d0243e983fce209cd6a68c309a7365365416f4b9db6be69bf0",
    "trees_lowest_common_ancestor_007": "sha256:f84e7cb4fcc998132dbf41ae79fc8904ba22cc630a7d0ebf96de6327618ca025"
  },
  "content_hash": "sha256:140d49cb129e7441792551c2466e83aa23f6bf96d826ba13f1dc782d0195e2fa"
}